[
    {
      "name": "佛跳墙",
      "desc": "海参、鲍鱼、鱼翅等多种食材煨制，味道浓厚鲜美。",
      "tags": ["seafood", "stewed", "fujian"],
      "allergens": ["fish", "shellfish"],
      "ingredients": ["abalone", "sea cucumber", "fish maw", "chicken", "pork"],
      "cuisine": "chinese",
      "lang": "zh",
      "dict_codes": { "allergens": ["fish", "shellfish"], "tags": ["seafood", "stewed", "fujian"], "cuisine": "chinese" },
      "extras": { "fp_v1": null },
      "source": { "site": null, "url": null, "external_id": null, "ingest_batch": null },
      "schema_version": "1.0.0",
      "created_at": "2025-08-25T19:20:00Z",
      "updated_at": "2025-08-25T19:20:00Z"
    },
    {
      "name": "荔枝肉",
      "desc": "猪肉炸制后裹糖醋汁，形似荔枝，酸甜可口。",
      "tags": ["sweet", "sour", "pork", "fujian"],
      "allergens": ["soy", "wheat"],
      "ingredients": ["pork", "vinegar", "sugar", "tomato paste"],
      "cuisine": "chinese",
      "lang": "zh",
      "dict_codes": { "allergens": ["soy", "wheat"], "tags": ["sweet", "sour", "pork", "fujian"], "cuisine": "chinese" },
      "extras": { "fp_v1": null },
      "source": { "site": null, "url": null, "external_id": null, "ingest_batch": null },
      "schema_version": "1.0.0",
      "created_at": "2025-08-25T19:20:00Z",
      "updated_at": "2025-08-25T19:20:00Z"
    },
    {
      "name": "沙茶面",
      "desc": "沙茶酱汤底，配猪肉、海鲜和面条，香浓微辣。",
      "tags": ["noodle", "spicy", "fujian"],
      "allergens": ["soy", "wheat", "peanut", "shrimp"],
      "ingredients": ["wheat noodles", "pork", "shrimp", "satay sauce"],
      "cuisine": "chinese",
      "lang": "zh",
      "dict_codes": { "allergens": ["soy", "wheat", "peanut", "shrimp"], "tags": ["noodle", "spicy", "fujian"], "cuisine": "chinese" },
      "extras": { "fp_v1": null },
      "source": { "site": null, "url": null, "external_id": null, "ingest_batch": null },
      "schema_version": "1.0.0",
      "created_at": "2025-08-25T19:20:00Z",
      "updated_at": "2025-08-25T19:20:00Z"
    },
    {
      "name": "海蛎煎",
      "desc": "海蛎裹淀粉鸡蛋煎制，外焦里嫩。",
      "tags": ["seafood", "oyster", "egg", "fujian"],
      "allergens": ["oyster", "egg"],
      "ingredients": ["oyster", "egg", "sweet potato starch", "scallion"],
      "cuisine": "chinese",
      "lang": "zh",
      "dict_codes": { "allergens": ["oyster", "egg"], "tags": ["seafood", "oyster", "egg", "fujian"], "cuisine": "chinese" },
      "extras": { "fp_v1": null },
      "source": { "site": null, "url": null, "external_id": null, "ingest_batch": null },
      "schema_version": "1.0.0",
      "created_at": "2025-08-25T19:20:00Z",
      "updated_at": "2025-08-25T19:20:00Z"
    },
    {
      "name": "醉排骨",
      "desc": "排骨炸制后浸泡米酒，酸甜醇香。",
      "tags": ["pork", "sweet", "fujian"],
      "allergens": ["soy"],
      "ingredients": ["pork ribs", "rice wine", "sugar", "soy sauce"],
      "cuisine": "chinese",
      "lang": "zh",
      "dict_codes": { "allergens": ["soy"], "tags": ["pork", "sweet", "fujian"], "cuisine": "chinese" },
      "extras": { "fp_v1": null },
      "source": { "site": null, "url": null, "external_id": null, "ingest_batch": null },
      "schema_version": "1.0.0",
      "created_at": "2025-08-25T19:20:00Z",
      "updated_at": "2025-08-25T19:20:00Z"
    },
    {
      "name": "笋干老鸭汤",
      "desc": "老鸭炖煮配笋干，汤鲜味浓。",
      "tags": ["soup", "duck", "fujian"],
      "allergens": [],
      "ingredients": ["duck", "dried bamboo shoots", "ginger", "salt"],
      "cuisine": "chinese",
      "lang": "zh",
      "dict_codes": { "allergens": [], "tags": ["soup", "duck", "fujian"], "cuisine": "chinese" },
      "extras": { "fp_v1": null },
      "source": { "site": null, "url": null, "external_id": null, "ingest_batch": null },
      "schema_version": "1.0.0",
      "created_at": "2025-08-25T19:20:00Z",
      "updated_at": "2025-08-25T19:20:00Z"
    },
    {
      "name": "漳州卤面",
      "desc": "卤汁浇在面条上，配猪肉、海鲜，鲜香咸口。",
      "tags": ["noodle", "braised", "fujian"],
      "allergens": ["soy", "wheat", "fish", "shrimp"],
      "ingredients": ["wheat noodles", "pork", "shrimp", "fish", "soy sauce"],
      "cuisine": "chinese",
      "lang": "zh",
      "dict_codes": { "allergens": ["soy", "wheat", "fish", "shrimp"], "tags": ["noodle", "braised", "fujian"], "cuisine": "chinese" },
      "extras": { "fp_v1": null },
      "source": { "site": null, "url": null, "external_id": null, "ingest_batch": null },
      "schema_version": "1.0.0",
      "created_at": "2025-08-25T19:20:00Z",
      "updated_at": "2025-08-25T19:20:00Z"
    },
    {
      "name": "东山羊",
      "desc": "东山岛特产羊肉，清炖或红烧，味鲜肉嫩。",
      "tags": ["lamb", "braised", "fujian"],
      "allergens": [],
      "ingredients": ["lamb", "ginger", "soy sauce", "spices"],
      "cuisine": "chinese",
      "lang": "zh",
      "dict_codes": { "allergens": [], "tags": ["lamb", "braised", "fujian"], "cuisine": "chinese" },
      "extras": { "fp_v1": null },
      "source": { "site": null, "url": null, "external_id": null, "ingest_batch": null },
      "schema_version": "1.0.0",
      "created_at": "2025-08-25T19:20:00Z",
      "updated_at": "2025-08-25T19:20:00Z"
    },
    {
      "name": "土笋冻",
      "desc": "海产沙虫熬制冷却成冻，口感爽滑。",
      "tags": ["seafood", "cold-dish", "fujian"],
      "allergens": ["shellfish"],
      "ingredients": ["sipunculus nudus", "soy sauce", "vinegar", "garlic"],
      "cuisine": "chinese",
      "lang": "zh",
      "dict_codes": { "allergens": ["shellfish"], "tags": ["seafood", "cold-dish", "fujian"], "cuisine": "chinese" },
      "extras": { "fp_v1": null },
      "source": { "site": null, "url": null, "external_id": null, "ingest_batch": null },
      "schema_version": "1.0.0",
      "created_at": "2025-08-25T19:20:00Z",
      "updated_at": "2025-08-25T19:20:00Z"
    },
    {
      "name": "五香卷",
      "desc": "猪肉馅卷入豆皮炸制，外脆里鲜。",
      "tags": ["fried", "pork", "fujian"],
      "allergens": ["soy"],
      "ingredients": ["pork", "beancurd skin", "five-spice powder", "garlic"],
      "cuisine": "chinese",
      "lang": "zh",
      "dict_codes": { "allergens": ["soy"], "tags": ["fried", "pork", "fujian"], "cuisine": "chinese" },
      "extras": { "fp_v1": null },
      "source": { "site": null, "url": null, "external_id": null, "ingest_batch": null },
      "schema_version": "1.0.0",
      "created_at": "2025-08-25T19:20:00Z",
      "updated_at": "2025-08-25T19:20:00Z"
    }
  ]
  