[
    {
      "name": "寿司",
      "desc": "醋饭配生鱼片或海鲜卷制，清新爽口。",
      "tags": ["sushi", "rice", "japanese"],
      "allergens": ["fish", "soy"],
      "ingredients": ["rice", "vinegar", "fish", "seaweed"],
      "cuisine": "japanese",
      "lang": "zh",
      "dict_codes": { "allergens": ["fish", "soy"], "tags": ["sushi", "rice", "japanese"], "cuisine": "japanese" },
      "schema_version": "1.0.0",
      "created_at": "2025-08-25T21:40:00Z",
      "updated_at": "2025-08-25T21:40:00Z"
    },
    {
      "name": "刺身",
      "desc": "新鲜鱼生切片，搭配酱油和芥末。",
      "tags": ["sashimi", "raw", "fish", "japanese"],
      "allergens": ["fish", "soy"],
      "ingredients": ["fish", "soy sauce", "wasabi"],
      "cuisine": "japanese",
      "lang": "zh",
      "dict_codes": { "allergens": ["fish", "soy"], "tags": ["sashimi", "raw", "fish", "japanese"], "cuisine": "japanese" },
      "schema_version": "1.0.0",
      "created_at": "2025-08-25T21:40:00Z",
      "updated_at": "2025-08-25T21:40:00Z"
    },
    {
      "name": "拉面",
      "desc": "小麦面条配汤底与叉烧、海苔等配料。",
      "tags": ["noodle", "soup", "japanese"],
      "allergens": ["wheat", "soy", "egg"],
      "ingredients": ["wheat noodles", "broth", "pork", "egg", "soy sauce"],
      "cuisine": "japanese",
      "lang": "zh",
      "dict_codes": { "allergens": ["wheat", "soy", "egg"], "tags": ["noodle", "soup", "japanese"], "cuisine": "japanese" },
      "schema_version": "1.0.0",
      "created_at": "2025-08-25T21:40:00Z",
      "updated_at": "2025-08-25T21:40:00Z"
    },
    {
      "name": "天妇罗",
      "desc": "海鲜和蔬菜裹粉油炸，外脆内嫩。",
      "tags": ["fried", "seafood", "vegetable", "japanese"],
      "allergens": ["wheat", "shrimp", "egg"],
      "ingredients": ["shrimp", "pumpkin", "sweet potato", "flour", "egg"],
      "cuisine": "japanese",
      "lang": "zh",
      "dict_codes": { "allergens": ["wheat", "shrimp", "egg"], "tags": ["fried", "seafood", "vegetable", "japanese"], "cuisine": "japanese" },
      "schema_version": "1.0.0",
      "created_at": "2025-08-25T21:40:00Z",
      "updated_at": "2025-08-25T21:40:00Z"
    },
    {
      "name": "烤鳗鱼饭",
      "desc": "烤鳗鱼刷酱汁，配米饭，香甜可口。",
      "tags": ["eel", "rice", "grilled", "japanese"],
      "allergens": ["fish", "soy"],
      "ingredients": ["eel", "soy sauce", "sugar", "rice"],
      "cuisine": "japanese",
      "lang": "zh",
      "dict_codes": { "allergens": ["fish", "soy"], "tags": ["eel", "rice", "grilled", "japanese"], "cuisine": "japanese" },
      "schema_version": "1.0.0",
      "created_at": "2025-08-25T21:40:00Z",
      "updated_at": "2025-08-25T21:40:00Z"
    },
    {
      "name": "章鱼烧",
      "desc": "小麦粉糊包裹章鱼粒，铁板烤制，外脆内软。",
      "tags": ["snack", "octopus", "japanese"],
      "allergens": ["wheat", "egg", "octopus"],
      "ingredients": ["octopus", "flour", "egg", "bonito flakes"],
      "cuisine": "japanese",
      "lang": "zh",
      "dict_codes": { "allergens": ["wheat", "egg", "octopus"], "tags": ["snack", "octopus", "japanese"], "cuisine": "japanese" },
      "schema_version": "1.0.0",
      "created_at": "2025-08-25T21:40:00Z",
      "updated_at": "2025-08-25T21:40:00Z"
    },
    {
      "name": "大阪烧",
      "desc": "卷心菜混合面糊煎饼，上铺酱汁和木鱼花。",
      "tags": ["pancake", "vegetable", "japanese"],
      "allergens": ["wheat", "egg", "soy"],
      "ingredients": ["flour", "egg", "cabbage", "soy sauce", "bonito flakes"],
      "cuisine": "japanese",
      "lang": "zh",
      "dict_codes": { "allergens": ["wheat", "egg", "soy"], "tags": ["pancake", "vegetable", "japanese"], "cuisine": "japanese" },
      "schema_version": "1.0.0",
      "created_at": "2025-08-25T21:40:00Z",
      "updated_at": "2025-08-25T21:40:00Z"
    },
    {
      "name": "寿喜烧",
      "desc": "牛肉片与蔬菜在酱油甜汤中涮煮。",
      "tags": ["beef", "hotpot", "japanese"],
      "allergens": ["soy"],
      "ingredients": ["beef", "soy sauce", "sugar", "tofu", "vegetables"],
      "cuisine": "japanese",
      "lang": "zh",
      "dict_codes": { "allergens": ["soy"], "tags": ["beef", "hotpot", "japanese"], "cuisine": "japanese" },
      "schema_version": "1.0.0",
      "created_at": "2025-08-25T21:40:00Z",
      "updated_at": "2025-08-25T21:40:00Z"
    },
    {
      "name": "味噌汤",
      "desc": "味噌酱煮汤，加入豆腐与海带，清淡鲜美。",
      "tags": ["soup", "tofu", "japanese"],
      "allergens": ["soy"],
      "ingredients": ["miso paste", "tofu", "seaweed", "scallion"],
      "cuisine": "japanese",
      "lang": "zh",
      "dict_codes": { "allergens": ["soy"], "tags": ["soup", "tofu", "japanese"], "cuisine": "japanese" },
      "schema_version": "1.0.0",
      "created_at": "2025-08-25T21:40:00Z",
      "updated_at": "2025-08-25T21:40:00Z"
    },
    {
      "name": "亲子丼",
      "desc": "鸡肉和鸡蛋煮在酱汁里，配米饭，咸甜适口。",
      "tags": ["chicken", "egg", "rice", "japanese"],
      "allergens": ["soy", "egg"],
      "ingredients": ["chicken", "egg", "rice", "soy sauce", "onion"],
      "cuisine": "japanese",
      "lang": "zh",
      "dict_codes": { "allergens": ["soy", "egg"], "tags": ["chicken", "egg", "rice", "japanese"], "cuisine": "japanese" },
      "schema_version": "1.0.0",
      "created_at": "2025-08-25T21:40:00Z",
      "updated_at": "2025-08-25T21:40:00Z"
    }
  ]
  