[
  {
    "name": "瓦伦西亚海鲜饭",
    "desc": "藏红花调味的米饭，搭配海鲜、鸡肉与蔬菜，色香味俱全。",
    "tags": [
      "rice",
      "seafood",
      "paella",
      "spanish"
    ],
    "allergens": [
      "shellfish",
      "fish"
    ],
    "ingredients": [
      "rice",
      "saffron",
      "shrimp",
      "mussel",
      "chicken",
      "peas"
    ],
    "cuisine": "spanish",
    "lang": "es",
    "dict_codes": {
      "allergens": [
        "shellfish",
        "fish"
      ],
      "tags": [
        "rice",
        "seafood",
        "paella",
        "spanish"
      ],
      "cuisine": "spanish"
    },
    "extras": {
      "fp_v1": null
    },
    "source": {
      "site": null,
      "url": null,
      "external_id": null,
      "ingest_batch": null
    },
    "schema_version": "1.0.0",
    "created_at": "2025-08-25T22:50:00Z",
    "updated_at": "2025-08-25T22:50:00Z"
  },
  {
    "name": "西班牙冷汤",
    "desc": "番茄、黄瓜、青椒制成的冷汤，夏季清爽开胃。",
    "tags": [
      "soup",
      "cold",
      "vegetable",
      "spanish"
    ],
    "allergens": [],
    "ingredients": [
      "tomato",
      "cucumber",
      "bell pepper",
      "olive oil",
      "bread"
    ],
    "cuisine": "spanish",
    "lang": "es",
    "dict_codes": {
      "allergens": [],
      "tags": [
        "soup",
        "cold",
        "vegetable",
        "spanish"
      ],
      "cuisine": "spanish"
    },
    "extras": {
      "fp_v1": null
    },
    "source": {
      "site": null,
      "url": null,
      "external_id": null,
      "ingest_batch": null
    },
    "schema_version": "1.0.0",
    "created_at": "2025-08-25T22:50:00Z",
    "updated_at": "2025-08-25T22:50:00Z"
  },
  {
    "name": "西班牙土豆蛋饼",
    "desc": "土豆片和洋葱炒制后加蛋煎成厚饼，松软可口。",
    "tags": [
      "egg",
      "potato",
      "omelette",
      "spanish"
    ],
    "allergens": [
      "egg"
    ],
    "ingredients": [
      "potato",
      "egg",
      "onion",
      "olive oil"
    ],
    "cuisine": "spanish",
    "lang": "es",
    "dict_codes": {
      "allergens": [
        "egg"
      ],
      "tags": [
        "egg",
        "potato",
        "omelette",
        "spanish"
      ],
      "cuisine": "spanish"
    },
    "extras": {
      "fp_v1": null
    },
    "source": {
      "site": null,
      "url": null,
      "external_id": null,
      "ingest_batch": null
    },
    "schema_version": "1.0.0",
    "created_at": "2025-08-25T22:50:00Z",
    "updated_at": "2025-08-25T22:50:00Z"
  },
  {
    "name": "伊比利亚火腿",
    "desc": "风干腌制的猪后腿，切成薄片食用，风味浓郁。",
    "tags": [
      "ham",
      "pork",
      "spanish"
    ],
    "allergens": [],
    "ingredients": [
      "iberico ham"
    ],
    "cuisine": "spanish",
    "lang": "es",
    "dict_codes": {
      "allergens": [],
      "tags": [
        "ham",
        "pork",
        "spanish"
      ],
      "cuisine": "spanish"
    },
    "extras": {
      "fp_v1": null
    },
    "source": {
      "site": null,
      "url": null,
      "external_id": null,
      "ingest_batch": null
    },
    "schema_version": "1.0.0",
    "created_at": "2025-08-25T22:50:00Z",
    "updated_at": "2025-08-25T22:50:00Z"
  },
  {
    "name": "小吃拼盘",
    "desc": "各式小份料理组合，如橄榄、香肠、烤土豆。",
    "tags": [
      "tapas",
      "snack",
      "spanish"
    ],
    "allergens": [],
    "ingredients": [
      "olive",
      "chorizo",
      "potato",
      "cheese"
    ],
    "cuisine": "spanish",
    "lang": "es",
    "dict_codes": {
      "allergens": [],
      "tags": [
        "tapas",
        "snack",
        "spanish"
      ],
      "cuisine": "spanish"
    },
    "extras": {
      "fp_v1": null
    },
    "source": {
      "site": null,
      "url": null,
      "external_id": null,
      "ingest_batch": null
    },
    "schema_version": "1.0.0",
    "created_at": "2025-08-25T22:50:00Z",
    "updated_at": "2025-08-25T22:50:00Z"
  },
  {
    "name": "蒜香虾",
    "desc": "橄榄油中煎炒大蒜与虾仁，香气扑鼻。",
    "tags": [
      "shrimp",
      "seafood",
      "spanish"
    ],
    "allergens": [
      "shrimp"
    ],
    "ingredients": [
      "shrimp",
      "garlic",
      "olive oil",
      "chili"
    ],
    "cuisine": "spanish",
    "lang": "es",
    "dict_codes": {
      "allergens": [
        "shrimp"
      ],
      "tags": [
        "shrimp",
        "seafood",
        "spanish"
      ],
      "cuisine": "spanish"
    },
    "extras": {
      "fp_v1": null
    },
    "source": {
      "site": null,
      "url": null,
      "external_id": null,
      "ingest_batch": null
    },
    "schema_version": "1.0.0",
    "created_at": "2025-08-25T22:50:00Z",
    "updated_at": "2025-08-25T22:50:00Z"
  },
  {
    "name": "辣香肠",
    "desc": "烟熏红椒调味的西班牙香肠，味道浓烈。",
    "tags": [
      "pork",
      "sausage",
      "chorizo",
      "spanish"
    ],
    "allergens": [],
    "ingredients": [
      "pork",
      "paprika",
      "garlic"
    ],
    "cuisine": "spanish",
    "lang": "es",
    "dict_codes": {
      "allergens": [],
      "tags": [
        "pork",
        "sausage",
        "chorizo",
        "spanish"
      ],
      "cuisine": "spanish"
    },
    "extras": {
      "fp_v1": null
    },
    "source": {
      "site": null,
      "url": null,
      "external_id": null,
      "ingest_batch": null
    },
    "schema_version": "1.0.0",
    "created_at": "2025-08-25T22:50:00Z",
    "updated_at": "2025-08-25T22:50:00Z"
  },
  {
    "name": "巴斯克炖鳕鱼",
    "desc": "鳕鱼与青椒、番茄炖煮，口感鲜美。",
    "tags": [
      "fish",
      "basque",
      "spanish"
    ],
    "allergens": [
      "fish"
    ],
    "ingredients": [
      "cod",
      "tomato",
      "green pepper",
      "garlic"
    ],
    "cuisine": "spanish",
    "lang": "es",
    "dict_codes": {
      "allergens": [
        "fish"
      ],
      "tags": [
        "fish",
        "basque",
        "spanish"
      ],
      "cuisine": "spanish"
    },
    "extras": {
      "fp_v1": null
    },
    "source": {
      "site": null,
      "url": null,
      "external_id": null,
      "ingest_batch": null
    },
    "schema_version": "1.0.0",
    "created_at": "2025-08-25T22:50:00Z",
    "updated_at": "2025-08-25T22:50:00Z"
  },
  {
    "name": "西班牙烩饭",
    "desc": "米饭与鸡肉、兔肉及豆类慢炖，源自瓦伦西亚传统。",
    "tags": [
      "rice",
      "meat",
      "spanish"
    ],
    "allergens": [],
    "ingredients": [
      "rice",
      "chicken",
      "rabbit",
      "green beans"
    ],
    "cuisine": "spanish",
    "lang": "es",
    "dict_codes": {
      "allergens": [],
      "tags": [
        "rice",
        "meat",
        "spanish"
      ],
      "cuisine": "spanish"
    },
    "extras": {
      "fp_v1": null
    },
    "source": {
      "site": null,
      "url": null,
      "external_id": null,
      "ingest_batch": null
    },
    "schema_version": "1.0.0",
    "created_at": "2025-08-25T22:50:00Z",
    "updated_at": "2025-08-25T22:50:00Z"
  },
  {
    "name": "炖牛尾",
    "desc": "牛尾与红酒、蔬菜慢炖，浓厚香醇。",
    "tags": [
      "beef",
      "stew",
      "spanish"
    ],
    "allergens": [],
    "ingredients": [
      "oxtail",
      "red wine",
      "onion",
      "carrot",
      "tomato"
    ],
    "cuisine": "spanish",
    "lang": "es",
    "dict_codes": {
      "allergens": [],
      "tags": [
        "beef",
        "stew",
        "spanish"
      ],
      "cuisine": "spanish"
    },
    "extras": {
      "fp_v1": null
    },
    "source": {
      "site": null,
      "url": null,
      "external_id": null,
      "ingest_batch": null
    },
    "schema_version": "1.0.0",
    "created_at": "2025-08-25T22:50:00Z",
    "updated_at": "2025-08-25T22:50:00Z"
  }
]
