[
  {
    "name": "炸鱼薯条",
    "desc": "裹面糊油炸的鱼排配炸薯条，英国国民料理。",
    "tags": [
      "fish",
      "fried",
      "chips",
      "british"
    ],
    "allergens": [
      "fish",
      "wheat"
    ],
    "ingredients": [
      "cod",
      "flour",
      "potato",
      "oil"
    ],
    "cuisine": "british",
    "lang": "en",
    "dict_codes": {
      "allergens": [
        "fish",
        "wheat"
      ],
      "tags": [
        "fish",
        "fried",
        "chips",
        "british"
      ],
      "cuisine": "british"
    },
    "extras": {
      "fp_v1": null
    },
    "source": {
      "site": null,
      "url": null,
      "external_id": null,
      "ingest_batch": null
    },
    "schema_version": "1.0.0",
    "created_at": "2025-08-26T00:00:00Z",
    "updated_at": "2025-08-26T00:00:00Z"
  },
  {
    "name": "全英式早餐",
    "desc": "鸡蛋、香肠、培根、烤豆和蘑菇的丰盛早餐。",
    "tags": [
      "breakfast",
      "egg",
      "sausage",
      "british"
    ],
    "allergens": [
      "egg"
    ],
    "ingredients": [
      "egg",
      "sausage",
      "bacon",
      "beans",
      "mushroom"
    ],
    "cuisine": "british",
    "lang": "en",
    "dict_codes": {
      "allergens": [
        "egg"
      ],
      "tags": [
        "breakfast",
        "egg",
        "sausage",
        "british"
      ],
      "cuisine": "british"
    },
    "extras": {
      "fp_v1": null
    },
    "source": {
      "site": null,
      "url": null,
      "external_id": null,
      "ingest_batch": null
    },
    "schema_version": "1.0.0",
    "created_at": "2025-08-26T00:00:00Z",
    "updated_at": "2025-08-26T00:00:00Z"
  },
  {
    "name": "牧羊人派",
    "desc": "牛肉末或羊肉末加蔬菜炖煮，上铺土豆泥烤制。",
    "tags": [
      "pie",
      "lamb",
      "beef",
      "british"
    ],
    "allergens": [
      "milk"
    ],
    "ingredients": [
      "minced lamb",
      "carrot",
      "pea",
      "potato",
      "butter"
    ],
    "cuisine": "british",
    "lang": "en",
    "dict_codes": {
      "allergens": [
        "milk"
      ],
      "tags": [
        "pie",
        "lamb",
        "beef",
        "british"
      ],
      "cuisine": "british"
    },
    "extras": {
      "fp_v1": null
    },
    "source": {
      "site": null,
      "url": null,
      "external_id": null,
      "ingest_batch": null
    },
    "schema_version": "1.0.0",
    "created_at": "2025-08-26T00:00:00Z",
    "updated_at": "2025-08-26T00:00:00Z"
  },
  {
    "name": "香肠土豆泥",
    "desc": "香肠配土豆泥和洋葱肉汁，是酒吧经典餐。",
    "tags": [
      "sausage",
      "potato",
      "british"
    ],
    "allergens": [
      "milk"
    ],
    "ingredients": [
      "sausage",
      "potato",
      "butter",
      "onion gravy"
    ],
    "cuisine": "british",
    "lang": "en",
    "dict_codes": {
      "allergens": [
        "milk"
      ],
      "tags": [
        "sausage",
        "potato",
        "british"
      ],
      "cuisine": "british"
    },
    "extras": {
      "fp_v1": null
    },
    "source": {
      "site": null,
      "url": null,
      "external_id": null,
      "ingest_batch": null
    },
    "schema_version": "1.0.0",
    "created_at": "2025-08-26T00:00:00Z",
    "updated_at": "2025-08-26T00:00:00Z"
  },
  {
    "name": "牛肉惠灵顿",
    "desc": "牛里脊包蘑菇泥和酥皮烘烤，英式宴会名菜。",
    "tags": [
      "beef",
      "pastry",
      "british"
    ],
    "allergens": [
      "wheat",
      "egg",
      "milk"
    ],
    "ingredients": [
      "beef fillet",
      "mushroom",
      "puff pastry",
      "egg",
      "butter"
    ],
    "cuisine": "british",
    "lang": "en",
    "dict_codes": {
      "allergens": [
        "wheat",
        "egg",
        "milk"
      ],
      "tags": [
        "beef",
        "pastry",
        "british"
      ],
      "cuisine": "british"
    },
    "extras": {
      "fp_v1": null
    },
    "source": {
      "site": null,
      "url": null,
      "external_id": null,
      "ingest_batch": null
    },
    "schema_version": "1.0.0",
    "created_at": "2025-08-26T00:00:00Z",
    "updated_at": "2025-08-26T00:00:00Z"
  },
  {
    "name": "牛排派",
    "desc": "酥皮内包牛肉馅和肉汁，口味浓厚。",
    "tags": [
      "pie",
      "beef",
      "british"
    ],
    "allergens": [
      "wheat",
      "milk"
    ],
    "ingredients": [
      "beef",
      "flour",
      "butter",
      "onion",
      "gravy"
    ],
    "cuisine": "british",
    "lang": "en",
    "dict_codes": {
      "allergens": [
        "wheat",
        "milk"
      ],
      "tags": [
        "pie",
        "beef",
        "british"
      ],
      "cuisine": "british"
    },
    "extras": {
      "fp_v1": null
    },
    "source": {
      "site": null,
      "url": null,
      "external_id": null,
      "ingest_batch": null
    },
    "schema_version": "1.0.0",
    "created_at": "2025-08-26T00:00:00Z",
    "updated_at": "2025-08-26T00:00:00Z"
  },
  {
    "name": "牛肉炖菜",
    "desc": "牛肉与根茎类蔬菜炖煮，爱尔兰家庭常见晚餐。",
    "tags": [
      "beef",
      "stew",
      "irish"
    ],
    "allergens": [],
    "ingredients": [
      "beef",
      "potato",
      "carrot",
      "onion"
    ],
    "cuisine": "irish",
    "lang": "en",
    "dict_codes": {
      "allergens": [],
      "tags": [
        "beef",
        "stew",
        "irish"
      ],
      "cuisine": "irish"
    },
    "extras": {
      "fp_v1": null
    },
    "source": {
      "site": null,
      "url": null,
      "external_id": null,
      "ingest_batch": null
    },
    "schema_version": "1.0.0",
    "created_at": "2025-08-26T00:00:00Z",
    "updated_at": "2025-08-26T00:00:00Z"
  },
  {
    "name": "爱尔兰羊肉炖菜",
    "desc": "羊肉与土豆、胡萝卜和洋葱慢炖，传统家常菜。",
    "tags": [
      "lamb",
      "stew",
      "irish"
    ],
    "allergens": [],
    "ingredients": [
      "lamb",
      "potato",
      "carrot",
      "onion"
    ],
    "cuisine": "irish",
    "lang": "en",
    "dict_codes": {
      "allergens": [],
      "tags": [
        "lamb",
        "stew",
        "irish"
      ],
      "cuisine": "irish"
    },
    "extras": {
      "fp_v1": null
    },
    "source": {
      "site": null,
      "url": null,
      "external_id": null,
      "ingest_batch": null
    },
    "schema_version": "1.0.0",
    "created_at": "2025-08-26T00:00:00Z",
    "updated_at": "2025-08-26T00:00:00Z"
  },
  {
    "name": "康沃尔馅饼",
    "desc": "酥皮包牛肉、土豆和洋葱，工人午餐起源。",
    "tags": [
      "cornish-pasty",
      "pastry",
      "british"
    ],
    "allergens": [
      "wheat",
      "milk"
    ],
    "ingredients": [
      "beef",
      "potato",
      "onion",
      "flour",
      "butter"
    ],
    "cuisine": "british",
    "lang": "en",
    "dict_codes": {
      "allergens": [
        "wheat",
        "milk"
      ],
      "tags": [
        "cornish-pasty",
        "pastry",
        "british"
      ],
      "cuisine": "british"
    },
    "extras": {
      "fp_v1": null
    },
    "source": {
      "site": null,
      "url": null,
      "external_id": null,
      "ingest_batch": null
    },
    "schema_version": "1.0.0",
    "created_at": "2025-08-26T00:00:00Z",
    "updated_at": "2025-08-26T00:00:00Z"
  },
  {
    "name": "约克郡布丁配烤牛肉",
    "desc": "烤牛肉搭配鸡蛋面糊烤制的松饼，英式周日大餐。",
    "tags": [
      "beef",
      "yorkshire-pudding",
      "british"
    ],
    "allergens": [
      "wheat",
      "egg",
      "milk"
    ],
    "ingredients": [
      "beef",
      "egg",
      "flour",
      "milk"
    ],
    "cuisine": "british",
    "lang": "en",
    "dict_codes": {
      "allergens": [
        "wheat",
        "egg",
        "milk"
      ],
      "tags": [
        "beef",
        "yorkshire-pudding",
        "british"
      ],
      "cuisine": "british"
    },
    "extras": {
      "fp_v1": null
    },
    "source": {
      "site": null,
      "url": null,
      "external_id": null,
      "ingest_batch": null
    },
    "schema_version": "1.0.0",
    "created_at": "2025-08-26T00:00:00Z",
    "updated_at": "2025-08-26T00:00:00Z"
  },
  {
    "name": "农夫午餐",
    "desc": "冷盘拼盘，包括奶酪、火腿、泡菜和面包。",
    "tags": [
      "ploughmans-lunch",
      "cheese",
      "british"
    ],
    "allergens": [
      "milk",
      "wheat"
    ],
    "ingredients": [
      "cheddar cheese",
      "ham",
      "pickle",
      "bread"
    ],
    "cuisine": "british",
    "lang": "en",
    "dict_codes": {
      "allergens": [
        "milk",
        "wheat"
      ],
      "tags": [
        "ploughmans-lunch",
        "cheese",
        "british"
      ],
      "cuisine": "british"
    },
    "extras": {
      "fp_v1": null
    },
    "source": {
      "site": null,
      "url": null,
      "external_id": null,
      "ingest_batch": null
    },
    "schema_version": "1.0.0",
    "created_at": "2025-08-26T00:00:00Z",
    "updated_at": "2025-08-26T00:00:00Z"
  },
  {
    "name": "苏格兰肉馅羊胃",
    "desc": "羊杂混燕麦和香料，装入羊胃烹煮，苏格兰特色。",
    "tags": [
      "haggis",
      "offal",
      "scottish"
    ],
    "allergens": [
      "wheat"
    ],
    "ingredients": [
      "sheep offal",
      "oatmeal",
      "onion",
      "spices"
    ],
    "cuisine": "scottish",
    "lang": "en",
    "dict_codes": {
      "allergens": [
        "wheat"
      ],
      "tags": [
        "haggis",
        "offal",
        "scottish"
      ],
      "cuisine": "scottish"
    },
    "extras": {
      "fp_v1": null
    },
    "source": {
      "site": null,
      "url": null,
      "external_id": null,
      "ingest_batch": null
    },
    "schema_version": "1.0.0",
    "created_at": "2025-08-26T00:00:00Z",
    "updated_at": "2025-08-26T00:00:00Z"
  }
]
