[
    {
      "name": "松鼠桂鱼",
      "desc": "桂鱼去骨造型如松鼠，油炸后浇糖醋汁，酸甜酥脆。",
      "tags": ["fish", "sweet", "sour", "fried", "jiangsu"],
      "allergens": ["fish", "soy", "wheat"],
      "ingredients": ["mandarin fish", "vinegar", "sugar", "soy sauce", "starch"],
      "cuisine": "chinese",
      "lang": "zh",
      "dict_codes": { "allergens": ["fish", "soy", "wheat"], "tags": ["fish", "sweet", "sour", "fried", "jiangsu"], "cuisine": "chinese" },
      "extras": { "fp_v1": null },
      "source": { "site": null, "url": null, "external_id": null, "ingest_batch": null },
      "schema_version": "1.0.0",
      "created_at": "2025-08-25T20:20:00Z",
      "updated_at": "2025-08-25T20:20:00Z"
    },
    {
      "name": "清炖蟹粉狮子头",
      "desc": "蟹粉拌肉丸，清炖成汤，肉质软糯鲜香。",
      "tags": ["pork", "crab", "soup", "jiangsu"],
      "allergens": ["crab", "soy"],
      "ingredients": ["pork", "crab roe", "soy sauce", "ginger", "broth"],
      "cuisine": "chinese",
      "lang": "zh",
      "dict_codes": { "allergens": ["crab", "soy"], "tags": ["pork", "crab", "soup", "jiangsu"], "cuisine": "chinese" },
      "extras": { "fp_v1": null },
      "source": { "site": null, "url": null, "external_id": null, "ingest_batch": null },
      "schema_version": "1.0.0",
      "created_at": "2025-08-25T20:20:00Z",
      "updated_at": "2025-08-25T20:20:00Z"
    },
    {
      "name": "叫花鸡",
      "desc": "整鸡腌制后荷叶包裹，泥封慢烤，肉香嫩滑。",
      "tags": ["chicken", "roasted", "jiangsu"],
      "allergens": ["soy"],
      "ingredients": ["chicken", "soy sauce", "ginger", "lotus leaf"],
      "cuisine": "chinese",
      "lang": "zh",
      "dict_codes": { "allergens": ["soy"], "tags": ["chicken", "roasted", "jiangsu"], "cuisine": "chinese" },
      "extras": { "fp_v1": null },
      "source": { "site": null, "url": null, "external_id": null, "ingest_batch": null },
      "schema_version": "1.0.0",
      "created_at": "2025-08-25T20:20:00Z",
      "updated_at": "2025-08-25T20:20:00Z"
    },
    {
      "name": "盐水鸭",
      "desc": "鸭子盐卤腌制后清煮，咸香清爽。",
      "tags": ["duck", "boiled", "jiangsu"],
      "allergens": [],
      "ingredients": ["duck", "salt", "ginger", "spices"],
      "cuisine": "chinese",
      "lang": "zh",
      "dict_codes": { "allergens": [], "tags": ["duck", "boiled", "jiangsu"], "cuisine": "chinese" },
      "extras": { "fp_v1": null },
      "source": { "site": null, "url": null, "external_id": null, "ingest_batch": null },
      "schema_version": "1.0.0",
      "created_at": "2025-08-25T20:20:00Z",
      "updated_at": "2025-08-25T20:20:00Z"
    },
    {
      "name": "双皮奶",
      "desc": "牛奶加蛋清蒸制成奶皮，口感细腻香甜。",
      "tags": ["dessert", "milk", "egg", "jiangsu"],
      "allergens": ["milk", "egg"],
      "ingredients": ["milk", "egg white", "sugar"],
      "cuisine": "chinese",
      "lang": "zh",
      "dict_codes": { "allergens": ["milk", "egg"], "tags": ["dessert", "milk", "egg", "jiangsu"], "cuisine": "chinese" },
      "extras": { "fp_v1": null },
      "source": { "site": null, "url": null, "external_id": null, "ingest_batch": null },
      "schema_version": "1.0.0",
      "created_at": "2025-08-25T20:20:00Z",
      "updated_at": "2025-08-25T20:20:00Z"
    },
    {
      "name": "金陵盐水鹅",
      "desc": "鹅肉盐水卤煮，肉质鲜嫩，咸香可口。",
      "tags": ["goose", "boiled", "jiangsu"],
      "allergens": [],
      "ingredients": ["goose", "salt", "ginger", "spices"],
      "cuisine": "chinese",
      "lang": "zh",
      "dict_codes": { "allergens": [], "tags": ["goose", "boiled", "jiangsu"], "cuisine": "chinese" },
      "extras": { "fp_v1": null },
      "source": { "site": null, "url": null, "external_id": null, "ingest_batch": null },
      "schema_version": "1.0.0",
      "created_at": "2025-08-25T20:20:00Z",
      "updated_at": "2025-08-25T20:20:00Z"
    },
    {
      "name": "大煮干丝",
      "desc": "豆腐干切丝，配虾仁、火腿煮制，清鲜爽口。",
      "tags": ["tofu", "shrimp", "soup", "jiangsu"],
      "allergens": ["soy", "shrimp"],
      "ingredients": ["tofu", "shrimp", "ham", "broth"],
      "cuisine": "chinese",
      "lang": "zh",
      "dict_codes": { "allergens": ["soy", "shrimp"], "tags": ["tofu", "shrimp", "soup", "jiangsu"], "cuisine": "chinese" },
      "extras": { "fp_v1": null },
      "source": { "site": null, "url": null, "external_id": null, "ingest_batch": null },
      "schema_version": "1.0.0",
      "created_at": "2025-08-25T20:20:00Z",
      "updated_at": "2025-08-25T20:20:00Z"
    },
    {
      "name": "清炖狮子头",
      "desc": "大肉丸子清炖，汤汁清鲜，肉质酥软。",
      "tags": ["pork", "meatball", "soup", "jiangsu"],
      "allergens": ["soy", "egg"],
      "ingredients": ["pork", "egg", "soy sauce", "ginger", "broth"],
      "cuisine": "chinese",
      "lang": "zh",
      "dict_codes": { "allergens": ["soy", "egg"], "tags": ["pork", "meatball", "soup", "jiangsu"], "cuisine": "chinese" },
      "extras": { "fp_v1": null },
      "source": { "site": null, "url": null, "external_id": null, "ingest_batch": null },
      "schema_version": "1.0.0",
      "created_at": "2025-08-25T20:20:00Z",
      "updated_at": "2025-08-25T20:20:00Z"
    },
    {
      "name": "拆烩鲢鱼头",
      "desc": "鲢鱼头炖煮后拆肉入羹，汤鲜味美。",
      "tags": ["fish", "soup", "jiangsu"],
      "allergens": ["fish", "soy"],
      "ingredients": ["fish head", "soy sauce", "ginger", "broth"],
      "cuisine": "chinese",
      "lang": "zh",
      "dict_codes": { "allergens": ["fish", "soy"], "tags": ["fish", "soup", "jiangsu"], "cuisine": "chinese" },
      "extras": { "fp_v1": null },
      "source": { "site": null, "url": null, "external_id": null, "ingest_batch": null },
      "schema_version": "1.0.0",
      "created_at": "2025-08-25T20:20:00Z",
      "updated_at": "2025-08-25T20:20:00Z"
    },
    {
      "name": "蟹黄汤包",
      "desc": "大汤包内馅含蟹黄和肉馅，汤汁鲜美。",
      "tags": ["dumpling", "soup", "crab", "jiangsu"],
      "allergens": ["crab", "soy", "wheat"],
      "ingredients": ["flour", "pork", "crab roe", "broth"],
      "cuisine": "chinese",
      "lang": "zh",
      "dict_codes": { "allergens": ["crab", "soy", "wheat"], "tags": ["dumpling", "soup", "crab", "jiangsu"], "cuisine": "chinese" },
      "extras": { "fp_v1": null },
      "source": { "site": null, "url": null, "external_id": null, "ingest_batch": null },
      "schema_version": "1.0.0",
      "created_at": "2025-08-25T20:20:00Z",
      "updated_at": "2025-08-25T20:20:00Z"
    }
  ]
  