[
    {
      "name": "西湖醋鱼",
      "desc": "草鱼清蒸后浇糖醋汁，酸甜鲜嫩。",
      "tags": ["fish", "sweet", "sour", "zhejiang"],
      "allergens": ["fish", "soy"],
      "ingredients": ["grass carp", "vinegar", "sugar", "soy sauce", "ginger"],
      "cuisine": "chinese",
      "lang": "zh",
      "dict_codes": { "allergens": ["fish", "soy"], "tags": ["fish", "sweet", "sour", "zhejiang"], "cuisine": "chinese" },
      "extras": { "fp_v1": null },
      "source": { "site": null, "url": null, "external_id": null, "ingest_batch": null },
      "schema_version": "1.0.0",
      "created_at": "2025-08-25T21:00:00Z",
      "updated_at": "2025-08-25T21:00:00Z"
    },
    {
      "name": "东坡肉",
      "desc": "五花肉红烧，肥而不腻，酱香浓郁。",
      "tags": ["pork", "braised", "zhejiang"],
      "allergens": ["soy"],
      "ingredients": ["pork belly", "soy sauce", "sugar", "ginger", "wine"],
      "cuisine": "chinese",
      "lang": "zh",
      "dict_codes": { "allergens": ["soy"], "tags": ["pork", "braised", "zhejiang"], "cuisine": "chinese" },
      "extras": { "fp_v1": null },
      "source": { "site": null, "url": null, "external_id": null, "ingest_batch": null },
      "schema_version": "1.0.0",
      "created_at": "2025-08-25T21:00:00Z",
      "updated_at": "2025-08-25T21:00:00Z"
    },
    {
      "name": "龙井虾仁",
      "desc": "虾仁配龙井茶炒制，清香鲜嫩。",
      "tags": ["shrimp", "stir-fry", "zhejiang"],
      "allergens": ["shrimp"],
      "ingredients": ["shrimp", "longjing tea", "egg white", "ginger"],
      "cuisine": "chinese",
      "lang": "zh",
      "dict_codes": { "allergens": ["shrimp"], "tags": ["shrimp", "stir-fry", "zhejiang"], "cuisine": "chinese" },
      "extras": { "fp_v1": null },
      "source": { "site": null, "url": null, "external_id": null, "ingest_batch": null },
      "schema_version": "1.0.0",
      "created_at": "2025-08-25T21:00:00Z",
      "updated_at": "2025-08-25T21:00:00Z"
    },
    {
      "name": "油焖春笋",
      "desc": "春笋红烧入味，清香爽口。",
      "tags": ["vegetable", "bamboo", "braised", "zhejiang"],
      "allergens": ["soy"],
      "ingredients": ["bamboo shoots", "soy sauce", "sugar", "oil"],
      "cuisine": "chinese",
      "lang": "zh",
      "dict_codes": { "allergens": ["soy"], "tags": ["vegetable", "bamboo", "braised", "zhejiang"], "cuisine": "chinese" },
      "extras": { "fp_v1": null },
      "source": { "site": null, "url": null, "external_id": null, "ingest_batch": null },
      "schema_version": "1.0.0",
      "created_at": "2025-08-25T21:00:00Z",
      "updated_at": "2025-08-25T21:00:00Z"
    },
    {
      "name": "叫化童鸡",
      "desc": "童子鸡腌制后荷叶裹泥焖烤，肉质鲜嫩。",
      "tags": ["chicken", "roasted", "zhejiang"],
      "allergens": ["soy"],
      "ingredients": ["chicken", "soy sauce", "ginger", "lotus leaf"],
      "cuisine": "chinese",
      "lang": "zh",
      "dict_codes": { "allergens": ["soy"], "tags": ["chicken", "roasted", "zhejiang"], "cuisine": "chinese" },
      "extras": { "fp_v1": null },
      "source": { "site": null, "url": null, "external_id": null, "ingest_batch": null },
      "schema_version": "1.0.0",
      "created_at": "2025-08-25T21:00:00Z",
      "updated_at": "2025-08-25T21:00:00Z"
    },
    {
      "name": "干菜焖肉",
      "desc": "梅干菜与五花肉同焖，咸香下饭。",
      "tags": ["pork", "braised", "zhejiang"],
      "allergens": ["soy"],
      "ingredients": ["pork belly", "preserved mustard greens", "soy sauce", "sugar"],
      "cuisine": "chinese",
      "lang": "zh",
      "dict_codes": { "allergens": ["soy"], "tags": ["pork", "braised", "zhejiang"], "cuisine": "chinese" },
      "extras": { "fp_v1": null },
      "source": { "site": null, "url": null, "external_id": null, "ingest_batch": null },
      "schema_version": "1.0.0",
      "created_at": "2025-08-25T21:00:00Z",
      "updated_at": "2025-08-25T21:00:00Z"
    },
    {
      "name": "西湖莼菜汤",
      "desc": "莼菜煮汤，清鲜爽滑。",
      "tags": ["soup", "vegetable", "zhejiang"],
      "allergens": [],
      "ingredients": ["brasenia schreberi", "broth", "ginger"],
      "cuisine": "chinese",
      "lang": "zh",
      "dict_codes": { "allergens": [], "tags": ["soup", "vegetable", "zhejiang"], "cuisine": "chinese" },
      "extras": { "fp_v1": null },
      "source": { "site": null, "url": null, "external_id": null, "ingest_batch": null },
      "schema_version": "1.0.0",
      "created_at": "2025-08-25T21:00:00Z",
      "updated_at": "2025-08-25T21:00:00Z"
    },
    {
      "name": "雪菜大汤黄鱼",
      "desc": "黄鱼配雪菜煮汤，鲜香开胃。",
      "tags": ["fish", "soup", "zhejiang"],
      "allergens": ["fish", "soy"],
      "ingredients": ["yellow croaker", "pickled mustard greens", "ginger", "soy sauce"],
      "cuisine": "chinese",
      "lang": "zh",
      "dict_codes": { "allergens": ["fish", "soy"], "tags": ["fish", "soup", "zhejiang"], "cuisine": "chinese" },
      "extras": { "fp_v1": null },
      "source": { "site": null, "url": null, "external_id": null, "ingest_batch": null },
      "schema_version": "1.0.0",
      "created_at": "2025-08-25T21:00:00Z",
      "updated_at": "2025-08-25T21:00:00Z"
    },
    {
      "name": "杭州酱鸭",
      "desc": "鸭子酱汁卤制，肉香浓厚。",
      "tags": ["duck", "braised", "zhejiang"],
      "allergens": ["soy"],
      "ingredients": ["duck", "soy sauce", "sugar", "spices"],
      "cuisine": "chinese",
      "lang": "zh",
      "dict_codes": { "allergens": ["soy"], "tags": ["duck", "braised", "zhejiang"], "cuisine": "chinese" },
      "extras": { "fp_v1": null },
      "source": { "site": null, "url": null, "external_id": null, "ingest_batch": null },
      "schema_version": "1.0.0",
      "created_at": "2025-08-25T21:00:00Z",
      "updated_at": "2025-08-25T21:00:00Z"
    },
    {
      "name": "莼菜鱼羹",
      "desc": "莼菜与鱼片煮羹，口感鲜滑。",
      "tags": ["fish", "soup", "zhejiang"],
      "allergens": ["fish"],
      "ingredients": ["fish", "brasenia schreberi", "broth", "ginger"],
      "cuisine": "chinese",
      "lang": "zh",
      "dict_codes": { "allergens": ["fish"], "tags": ["fish", "soup", "zhejiang"], "cuisine": "chinese" },
      "extras": { "fp_v1": null },
      "source": { "site": null, "url": null, "external_id": null, "ingest_batch": null },
      "schema_version": "1.0.0",
      "created_at": "2025-08-25T21:00:00Z",
      "updated_at": "2025-08-25T21:00:00Z"
    }
  ]
  