[
    {
      "name": "锅包肉",
      "desc": "猪里脊挂糊炸至酥脆，裹酸甜酱汁，外酥里嫩。",
      "tags": ["pork", "sweet", "sour", "dongbei"],
      "allergens": ["soy", "wheat"],
      "ingredients": ["pork loin", "starch", "vinegar", "sugar", "soy sauce"],
      "cuisine": "chinese",
      "lang": "zh",
      "dict_codes": { "allergens": ["soy", "wheat"], "tags": ["pork", "sweet", "sour", "dongbei"], "cuisine": "chinese" },
      "extras": { "fp_v1": null },
      "source": { "site": null, "url": null, "external_id": null, "ingest_batch": null },
      "schema_version": "1.0.0",
      "created_at": "2025-08-25T20:00:00Z",
      "updated_at": "2025-08-25T20:00:00Z"
    },
    {
      "name": "小鸡炖蘑菇",
      "desc": "土鸡与榛蘑炖煮，汤汁浓郁，鸡肉鲜香。",
      "tags": ["chicken", "mushroom", "stewed", "dongbei"],
      "allergens": [],
      "ingredients": ["chicken", "mushroom", "ginger", "garlic"],
      "cuisine": "chinese",
      "lang": "zh",
      "dict_codes": { "allergens": [], "tags": ["chicken", "mushroom", "stewed", "dongbei"], "cuisine": "chinese" },
      "extras": { "fp_v1": null },
      "source": { "site": null, "url": null, "external_id": null, "ingest_batch": null },
      "schema_version": "1.0.0",
      "created_at": "2025-08-25T20:00:00Z",
      "updated_at": "2025-08-25T20:00:00Z"
    },
    {
      "name": "地三鲜",
      "desc": "土豆、茄子、青椒油炸后合炒，鲜香浓郁。",
      "tags": ["vegetable", "potato", "eggplant", "dongbei"],
      "allergens": ["soy"],
      "ingredients": ["potato", "eggplant", "green pepper", "soy sauce"],
      "cuisine": "chinese",
      "lang": "zh",
      "dict_codes": { "allergens": ["soy"], "tags": ["vegetable", "potato", "eggplant", "dongbei"], "cuisine": "chinese" },
      "extras": { "fp_v1": null },
      "source": { "site": null, "url": null, "external_id": null, "ingest_batch": null },
      "schema_version": "1.0.0",
      "created_at": "2025-08-25T20:00:00Z",
      "updated_at": "2025-08-25T20:00:00Z"
    },
    {
      "name": "杀猪菜",
      "desc": "猪肉、血肠与酸菜炖煮，东北冬季传统大菜。",
      "tags": ["pork", "stewed", "dongbei"],
      "allergens": [],
      "ingredients": ["pork", "blood sausage", "pickled cabbage", "garlic"],
      "cuisine": "chinese",
      "lang": "zh",
      "dict_codes": { "allergens": [], "tags": ["pork", "stewed", "dongbei"], "cuisine": "chinese" },
      "extras": { "fp_v1": null },
      "source": { "site": null, "url": null, "external_id": null, "ingest_batch": null },
      "schema_version": "1.0.0",
      "created_at": "2025-08-25T20:00:00Z",
      "updated_at": "2025-08-25T20:00:00Z"
    },
    {
      "name": "酸菜白肉锅",
      "desc": "酸菜与五花肉片炖煮，汤汁酸爽。",
      "tags": ["pork", "sour", "hotpot", "dongbei"],
      "allergens": [],
      "ingredients": ["pork belly", "pickled cabbage", "vermicelli", "garlic"],
      "cuisine": "chinese",
      "lang": "zh",
      "dict_codes": { "allergens": [], "tags": ["pork", "sour", "hotpot", "dongbei"], "cuisine": "chinese" },
      "extras": { "fp_v1": null },
      "source": { "site": null, "url": null, "external_id": null, "ingest_batch": null },
      "schema_version": "1.0.0",
      "created_at": "2025-08-25T20:00:00Z",
      "updated_at": "2025-08-25T20:00:00Z"
    },
    {
      "name": "溜肉段",
      "desc": "猪肉块挂糊炸制后，炒制酸甜酱汁，口感鲜嫩。",
      "tags": ["pork", "sweet", "sour", "dongbei"],
      "allergens": ["soy", "wheat"],
      "ingredients": ["pork", "vinegar", "sugar", "soy sauce", "starch"],
      "cuisine": "chinese",
      "lang": "zh",
      "dict_codes": { "allergens": ["soy", "wheat"], "tags": ["pork", "sweet", "sour", "dongbei"], "cuisine": "chinese" },
      "extras": { "fp_v1": null },
      "source": { "site": null, "url": null, "external_id": null, "ingest_batch": null },
      "schema_version": "1.0.0",
      "created_at": "2025-08-25T20:00:00Z",
      "updated_at": "2025-08-25T20:00:00Z"
    },
    {
      "name": "锅塌豆腐",
      "desc": "豆腐挂糊煎制，口感外酥里嫩，酱香浓郁。",
      "tags": ["tofu", "fried", "dongbei"],
      "allergens": ["soy", "egg", "wheat"],
      "ingredients": ["tofu", "egg", "flour", "soy sauce"],
      "cuisine": "chinese",
      "lang": "zh",
      "dict_codes": { "allergens": ["soy", "egg", "wheat"], "tags": ["tofu", "fried", "dongbei"], "cuisine": "chinese" },
      "extras": { "fp_v1": null },
      "source": { "site": null, "url": null, "external_id": null, "ingest_batch": null },
      "schema_version": "1.0.0",
      "created_at": "2025-08-25T20:00:00Z",
      "updated_at": "2025-08-25T20:00:00Z"
    },
    {
      "name": "铁锅炖大鹅",
      "desc": "大鹅与土豆、粉条炖煮，肉香汤浓。",
      "tags": ["goose", "stewed", "dongbei"],
      "allergens": [],
      "ingredients": ["goose", "potato", "vermicelli", "ginger"],
      "cuisine": "chinese",
      "lang": "zh",
      "dict_codes": { "allergens": [], "tags": ["goose", "stewed", "dongbei"], "cuisine": "chinese" },
      "extras": { "fp_v1": null },
      "source": { "site": null, "url": null, "external_id": null, "ingest_batch": null },
      "schema_version": "1.0.0",
      "created_at": "2025-08-25T20:00:00Z",
      "updated_at": "2025-08-25T20:00:00Z"
    },
    {
      "name": "酸菜汆白肉",
      "desc": "白肉片搭配酸菜和粉条，清爽开胃。",
      "tags": ["pork", "sour", "soup", "dongbei"],
      "allergens": [],
      "ingredients": ["pork", "pickled cabbage", "vermicelli", "scallion"],
      "cuisine": "chinese",
      "lang": "zh",
      "dict_codes": { "allergens": [], "tags": ["pork", "sour", "soup", "dongbei"], "cuisine": "chinese" },
      "extras": { "fp_v1": null },
      "source": { "site": null, "url": null, "external_id": null, "ingest_batch": null },
      "schema_version": "1.0.0",
      "created_at": "2025-08-25T20:00:00Z",
      "updated_at": "2025-08-25T20:00:00Z"
    },
    {
      "name": "芸豆炖排骨",
      "desc": "排骨与芸豆炖制，汤汁浓郁，肉烂豆香。",
      "tags": ["pork", "beans", "stewed", "dongbei"],
      "allergens": [],
      "ingredients": ["pork ribs", "kidney beans", "ginger", "garlic"],
      "cuisine": "chinese",
      "lang": "zh",
      "dict_codes": { "allergens": [], "tags": ["pork", "beans", "stewed", "dongbei"], "cuisine": "chinese" },
      "extras": { "fp_v1": null },
      "source": { "site": null, "url": null, "external_id": null, "ingest_batch": null },
      "schema_version": "1.0.0",
      "created_at": "2025-08-25T20:00:00Z",
      "updated_at": "2025-08-25T20:00:00Z"
    }
  ]
  