[
    {
      "name": "剁椒鱼头",
      "desc": "胖头鱼头蒸制，铺满剁椒，鲜辣浓郁。",
      "tags": ["spicy", "fish", "hunan"],
      "allergens": ["fish"],
      "ingredients": ["fish head", "chopped chili", "ginger", "garlic"],
      "cuisine": "chinese",
      "lang": "zh",
      "dict_codes": { "allergens": ["fish"], "tags": ["spicy", "fish", "hunan"], "cuisine": "chinese" },
      "extras": { "fp_v1": null },
      "source": { "site": null, "url": null, "external_id": null, "ingest_batch": null },
      "schema_version": "1.0.0",
      "created_at": "2025-08-25T19:00:00Z",
      "updated_at": "2025-08-25T19:00:00Z"
    },
    {
      "name": "口味虾",
      "desc": "小龙虾炒制，麻辣鲜香，汁浓味厚。",
      "tags": ["spicy", "seafood", "hunan"],
      "allergens": ["shrimp"],
      "ingredients": ["crayfish", "chili", "peppercorn", "garlic"],
      "cuisine": "chinese",
      "lang": "zh",
      "dict_codes": { "allergens": ["shrimp"], "tags": ["spicy", "seafood", "hunan"], "cuisine": "chinese" },
      "extras": { "fp_v1": null },
      "source": { "site": null, "url": null, "external_id": null, "ingest_batch": null },
      "schema_version": "1.0.0",
      "created_at": "2025-08-25T19:00:00Z",
      "updated_at": "2025-08-25T19:00:00Z"
    },
    {
      "name": "农家小炒肉",
      "desc": "五花肉片与青椒快炒，香辣下饭。",
      "tags": ["spicy", "pork", "hunan"],
      "allergens": ["soy"],
      "ingredients": ["pork belly", "green chili", "soy sauce", "garlic"],
      "cuisine": "chinese",
      "lang": "zh",
      "dict_codes": { "allergens": ["soy"], "tags": ["spicy", "pork", "hunan"], "cuisine": "chinese" },
      "extras": { "fp_v1": null },
      "source": { "site": null, "url": null, "external_id": null, "ingest_batch": null },
      "schema_version": "1.0.0",
      "created_at": "2025-08-25T19:00:00Z",
      "updated_at": "2025-08-25T19:00:00Z"
    },
    {
      "name": "麻辣子鸡",
      "desc": "鸡块炸香，拌入辣椒与花椒，干香麻辣。",
      "tags": ["spicy", "chicken", "hunan"],
      "allergens": [],
      "ingredients": ["chicken", "dried chili", "peppercorn", "ginger"],
      "cuisine": "chinese",
      "lang": "zh",
      "dict_codes": { "allergens": [], "tags": ["spicy", "chicken", "hunan"], "cuisine": "chinese" },
      "extras": { "fp_v1": null },
      "source": { "site": null, "url": null, "external_id": null, "ingest_batch": null },
      "schema_version": "1.0.0",
      "created_at": "2025-08-25T19:00:00Z",
      "updated_at": "2025-08-25T19:00:00Z"
    },
    {
      "name": "腊味合蒸",
      "desc": "腊肉与腊肠合蒸，咸香浓郁。",
      "tags": ["smoked", "pork", "hunan"],
      "allergens": ["soy"],
      "ingredients": ["smoked pork", "chinese sausage", "soy sauce"],
      "cuisine": "chinese",
      "lang": "zh",
      "dict_codes": { "allergens": ["soy"], "tags": ["smoked", "pork", "hunan"], "cuisine": "chinese" },
      "extras": { "fp_v1": null },
      "source": { "site": null, "url": null, "external_id": null, "ingest_batch": null },
      "schema_version": "1.0.0",
      "created_at": "2025-08-25T19:00:00Z",
      "updated_at": "2025-08-25T19:00:00Z"
    },
    {
      "name": "剁椒蒸茄子",
      "desc": "茄子蒸制，浇上剁椒酱，酸辣开胃。",
      "tags": ["spicy", "vegetable", "hunan"],
      "allergens": [],
      "ingredients": ["eggplant", "chopped chili", "garlic", "soy sauce"],
      "cuisine": "chinese",
      "lang": "zh",
      "dict_codes": { "allergens": [], "tags": ["spicy", "vegetable", "hunan"], "cuisine": "chinese" },
      "extras": { "fp_v1": null },
      "source": { "site": null, "url": null, "external_id": null, "ingest_batch": null },
      "schema_version": "1.0.0",
      "created_at": "2025-08-25T19:00:00Z",
      "updated_at": "2025-08-25T19:00:00Z"
    },
    {
      "name": "外婆菜炒蛋",
      "desc": "腌制外婆菜炒鸡蛋，咸香开胃。",
      "tags": ["egg", "hunan"],
      "allergens": ["egg"],
      "ingredients": ["egg", "pickled vegetable", "oil"],
      "cuisine": "chinese",
      "lang": "zh",
      "dict_codes": { "allergens": ["egg"], "tags": ["egg", "hunan"], "cuisine": "chinese" },
      "extras": { "fp_v1": null },
      "source": { "site": null, "url": null, "external_id": null, "ingest_batch": null },
      "schema_version": "1.0.0",
      "created_at": "2025-08-25T19:00:00Z",
      "updated_at": "2025-08-25T19:00:00Z"
    },
    {
      "name": "红烧鱼块",
      "desc": "鱼块红烧，辣椒调味，酱香浓厚。",
      "tags": ["spicy", "fish", "braised", "hunan"],
      "allergens": ["fish", "soy"],
      "ingredients": ["fish", "chili", "soy sauce", "ginger"],
      "cuisine": "chinese",
      "lang": "zh",
      "dict_codes": { "allergens": ["fish", "soy"], "tags": ["spicy", "fish", "braised", "hunan"], "cuisine": "chinese" },
      "extras": { "fp_v1": null },
      "source": { "site": null, "url": null, "external_id": null, "ingest_batch": null },
      "schema_version": "1.0.0",
      "created_at": "2025-08-25T19:00:00Z",
      "updated_at": "2025-08-25T19:00:00Z"
    },
    {
      "name": "剁椒蒸排骨",
      "desc": "排骨与剁椒蒸制，咸辣入味。",
      "tags": ["spicy", "pork", "hunan"],
      "allergens": ["soy"],
      "ingredients": ["pork ribs", "chopped chili", "soy sauce", "ginger"],
      "cuisine": "chinese",
      "lang": "zh",
      "dict_codes": { "allergens": ["soy"], "tags": ["spicy", "pork", "hunan"], "cuisine": "chinese" },
      "extras": { "fp_v1": null },
      "source": { "site": null, "url": null, "external_id": null, "ingest_batch": null },
      "schema_version": "1.0.0",
      "created_at": "2025-08-25T19:00:00Z",
      "updated_at": "2025-08-25T19:00:00Z"
    }
  ]
  