[
    {
      "name": "臭鳜鱼",
      "desc": "鳜鱼腌制发酵后油炸，再红烧，外酥里嫩，味道独特。",
      "tags": ["fish", "fermented", "braised", "anhui"],
      "allergens": ["fish", "soy"],
      "ingredients": ["mandarin fish", "soy sauce", "ginger", "chili"],
      "cuisine": "chinese",
      "lang": "zh",
      "dict_codes": { "allergens": ["fish", "soy"], "tags": ["fish", "fermented", "braised", "anhui"], "cuisine": "chinese" },
      "extras": { "fp_v1": null },
      "source": { "site": null, "url": null, "external_id": null, "ingest_batch": null },
      "schema_version": "1.0.0",
      "created_at": "2025-08-25T20:40:00Z",
      "updated_at": "2025-08-25T20:40:00Z"
    },
    {
      "name": "黄山炖鸽",
      "desc": "乳鸽与火腿、笋干同炖，汤清味鲜。",
      "tags": ["pigeon", "soup", "anhui"],
      "allergens": [],
      "ingredients": ["pigeon", "ham", "dried bamboo shoots", "broth"],
      "cuisine": "chinese",
      "lang": "zh",
      "dict_codes": { "allergens": [], "tags": ["pigeon", "soup", "anhui"], "cuisine": "chinese" },
      "extras": { "fp_v1": null },
      "source": { "site": null, "url": null, "external_id": null, "ingest_batch": null },
      "schema_version": "1.0.0",
      "created_at": "2025-08-25T20:40:00Z",
      "updated_at": "2025-08-25T20:40:00Z"
    },
    {
      "name": "毛豆腐",
      "desc": "豆腐表面发酵长毛，煎后配辣酱，口感独特。",
      "tags": ["tofu", "fermented", "anhui"],
      "allergens": ["soy"],
      "ingredients": ["fermented tofu", "chili paste", "garlic"],
      "cuisine": "chinese",
      "lang": "zh",
      "dict_codes": { "allergens": ["soy"], "tags": ["tofu", "fermented", "anhui"], "cuisine": "chinese" },
      "extras": { "fp_v1": null },
      "source": { "site": null, "url": null, "external_id": null, "ingest_batch": null },
      "schema_version": "1.0.0",
      "created_at": "2025-08-25T20:40:00Z",
      "updated_at": "2025-08-25T20:40:00Z"
    },
    {
      "name": "黄山炖鸽蛋",
      "desc": "鸽蛋与火腿笋干清炖，汤鲜味美。",
      "tags": ["egg", "soup", "anhui"],
      "allergens": ["egg"],
      "ingredients": ["pigeon egg", "ham", "broth", "ginger"],
      "cuisine": "chinese",
      "lang": "zh",
      "dict_codes": { "allergens": ["egg"], "tags": ["egg", "soup", "anhui"], "cuisine": "chinese" },
      "extras": { "fp_v1": null },
      "source": { "site": null, "url": null, "external_id": null, "ingest_batch": null },
      "schema_version": "1.0.0",
      "created_at": "2025-08-25T20:40:00Z",
      "updated_at": "2025-08-25T20:40:00Z"
    },
    {
      "name": "徽州蒸鸡",
      "desc": "鸡肉与火腿、笋干同蒸，咸香入味。",
      "tags": ["chicken", "steamed", "anhui"],
      "allergens": ["soy"],
      "ingredients": ["chicken", "ham", "dried bamboo shoots", "soy sauce"],
      "cuisine": "chinese",
      "lang": "zh",
      "dict_codes": { "allergens": ["soy"], "tags": ["chicken", "steamed", "anhui"], "cuisine": "chinese" },
      "extras": { "fp_v1": null },
      "source": { "site": null, "url": null, "external_id": null, "ingest_batch": null },
      "schema_version": "1.0.0",
      "created_at": "2025-08-25T20:40:00Z",
      "updated_at": "2025-08-25T20:40:00Z"
    },
    {
      "name": "腌鲜鳜鱼",
      "desc": "鳜鱼先腌后炖，肉质鲜嫩，咸鲜味浓。",
      "tags": ["fish", "braised", "anhui"],
      "allergens": ["fish", "soy"],
      "ingredients": ["mandarin fish", "salt", "soy sauce", "ginger"],
      "cuisine": "chinese",
      "lang": "zh",
      "dict_codes": { "allergens": ["fish", "soy"], "tags": ["fish", "braised", "anhui"], "cuisine": "chinese" },
      "extras": { "fp_v1": null },
      "source": { "site": null, "url": null, "external_id": null, "ingest_batch": null },
      "schema_version": "1.0.0",
      "created_at": "2025-08-25T20:40:00Z",
      "updated_at": "2025-08-25T20:40:00Z"
    },
    {
      "name": "问政山笋",
      "desc": "山笋切片红烧，味道清香爽口。",
      "tags": ["vegetable", "bamboo", "braised", "anhui"],
      "allergens": ["soy"],
      "ingredients": ["bamboo shoots", "soy sauce", "ginger", "sugar"],
      "cuisine": "chinese",
      "lang": "zh",
      "dict_codes": { "allergens": ["soy"], "tags": ["vegetable", "bamboo", "braised", "anhui"], "cuisine": "chinese" },
      "extras": { "fp_v1": null },
      "source": { "site": null, "url": null, "external_id": null, "ingest_batch": null },
      "schema_version": "1.0.0",
      "created_at": "2025-08-25T20:40:00Z",
      "updated_at": "2025-08-25T20:40:00Z"
    },
    {
      "name": "八公山豆腐",
      "desc": "豆腐嫩滑，配以香菇火腿煨制，汤汁鲜美。",
      "tags": ["tofu", "stewed", "anhui"],
      "allergens": ["soy"],
      "ingredients": ["tofu", "mushroom", "ham", "broth"],
      "cuisine": "chinese",
      "lang": "zh",
      "dict_codes": { "allergens": ["soy"], "tags": ["tofu", "stewed", "anhui"], "cuisine": "chinese" },
      "extras": { "fp_v1": null },
      "source": { "site": null, "url": null, "external_id": null, "ingest_batch": null },
      "schema_version": "1.0.0",
      "created_at": "2025-08-25T20:40:00Z",
      "updated_at": "2025-08-25T20:40:00Z"
    },
    {
      "name": "符离集烧鸡",
      "desc": "整鸡卤煮焖制，皮色金黄，香味浓郁。",
      "tags": ["chicken", "braised", "anhui"],
      "allergens": ["soy"],
      "ingredients": ["chicken", "soy sauce", "spices", "ginger"],
      "cuisine": "chinese",
      "lang": "zh",
      "dict_codes": { "allergens": ["soy"], "tags": ["chicken", "braised", "anhui"], "cuisine": "chinese" },
      "extras": { "fp_v1": null },
      "source": { "site": null, "url": null, "external_id": null, "ingest_batch": null },
      "schema_version": "1.0.0",
      "created_at": "2025-08-25T20:40:00Z",
      "updated_at": "2025-08-25T20:40:00Z"
    },
    {
      "name": "胡适一品锅",
      "desc": "鸡肉、猪肉、火腿与蔬菜分层煨制，丰盛醇厚。",
      "tags": ["stewed", "chicken", "pork", "anhui"],
      "allergens": ["soy"],
      "ingredients": ["chicken", "pork", "ham", "cabbage", "soy sauce"],
      "cuisine": "chinese",
      "lang": "zh",
      "dict_codes": { "allergens": ["soy"], "tags": ["stewed", "chicken", "pork", "anhui"], "cuisine": "chinese" },
      "extras": { "fp_v1": null },
      "source": { "site": null, "url": null, "external_id": null, "ingest_batch": null },
      "schema_version": "1.0.0",
      "created_at": "2025-08-25T20:40:00Z",
      "updated_at": "2025-08-25T20:40:00Z"
    }
  ]
  